{
  "$schema": "http://json-schema.org/draft-07/schema#",
  "title": "PCI Evidence Item",
  "type": "object",
  "properties": {
    "id": {
      "type": "string"
    },
    "requirement": {
      "type": "string"
    },
    "control_family": {
      "type": "string"
    },
    "description": {
      "type": "string"
    },
    "source": {
      "type": "string"
    },
    "timestamp": {
      "type": "string",
      "format": "date-time"
    },
    "tags": {
      "type": "array",
      "items": {
        "type": "string"
      }
    },
    "attachments": {
      "type": "array",
      "items": {
        "type": "object",
        "properties": {
          "filename": {
            "type": "string"
          },
          "url": {
            "type": "string",
            "format": "uri"
          }
        },
        "required": [
          "filename",
          "url"
        ]
      }
    }
  },
  "required": [
    "id",
    "requirement",
    "description",
    "timestamp"
  ]
}